{
  "schema_version": 1,
  "timeline_event_id": "evt_tw_harbor_market_square",
  "canonical_name": "Market Square Inquiry",
  "timeline_scale": "moment",
  "occurred_at": "2026-07-23T06:30:00Z",
  "description": "Mira asks dockhands and chart vendors in the market square for leads on the cartographer's guild.",
  "participant_entry_ids": ["kb_tw_mira", "kb_tw_harbor"],
  "source_anchor": {
    "schema_version": 1,
    "source_id": "manuscript:tw-ch1",
    "span": { "start": 121, "end": 210 },
    "extensions": {}
  },
  "sort_key": "ch1-002",
  "created_at": "2026-07-23T06:30:00Z",
  "updated_at": "2026-07-23T06:30:00Z",
  "extensions": {
    "nexus": {
      "world_id": "wld_toy_nexus_001"
    },
    "spoke": {
      "timeline_entry_id": "kb_tw_harbor_market_square_event"
    }
  }
}
