{
  "schema_version": 1,
  "timeline_event_id": "evt_tw_harbor_customs_gate",
  "canonical_name": "Customs Gate Inspection",
  "timeline_scale": "moment",
  "occurred_at": "2026-07-23T07:15:00Z",
  "description": "Harbor officials inspect Mira's coastal charts at the customs gate before she may enter the inner docks.",
  "participant_entry_ids": ["kb_tw_mira", "kb_tw_harbor"],
  "source_anchor": {
    "schema_version": 1,
    "source_id": "manuscript:tw-ch1",
    "span": { "start": 211, "end": 298 },
    "extensions": {}
  },
  "sort_key": "ch1-003",
  "created_at": "2026-07-23T07:15:00Z",
  "updated_at": "2026-07-23T07:15:00Z",
  "extensions": {
    "nexus": {
      "world_id": "wld_toy_nexus_001"
    },
    "spoke": {
      "timeline_entry_id": "kb_tw_harbor_customs_gate_beat"
    }
  }
}
